<?xml version="1.0" encoding="UTF-8"?>
<!ELEMENT ARTICLES (ARTICLE*)>
<!ELEMENT ARTICLE (ARTICLEDATA*)>
<!ELEMENT ARTICLEDATA (TITLE,AUTHOR)>
<!ELEMENT TITLE (#PCDATA)>
<!ELEMENT AUTHOR (#PCDATA)>
